{"$schema":"https://json-schema.org/draft/2020-12/schema","additionalProperties":true,"properties":{"generated_at":{"type":"string"},"items":{"items":{"additionalProperties":true,"properties":{"components":{"additionalProperties":false,"properties":{"location":{"type":"number"},"needs":{"type":"number"},"price":{"type":"number"},"quality":{"type":"number"}},"required":["location","price","quality","needs"],"type":"object"},"fit_score":{"type":"number"},"provider_id":{"type":"string"},"receipts":{"items":{"type":"object"},"type":"array"}},"required":["provider_id","fit_score","components","receipts"],"type":"object"},"minItems":1,"type":"array"},"preset":{"type":"string"},"query":{"properties":{"budget_per_day":{"type":"number"},"needs":{"items":{"type":"string"},"type":"array"},"postcode":{"type":["string","number"]},"radius_km":{"type":"number"}},"required":["postcode","radius_km","budget_per_day","needs"],"type":"object"}},"required":["query","preset","generated_at","items"],"title":"top5","type":"object"}