{"generated_at":"2025-09-08T00:00:00Z","items":[{"components":{"location":0.0,"needs":0.0,"price":1.0,"quality":0.8},"fit_score":0.54,"provider_id":"racs_160","receipts":[{"kind":"doc_ingest","observed_at":"2025-09-08T00:00:00Z","provider_id":"racs_160","sha256":"08f1dd40f4576caa851d2debf1697ec6addd17d073fb71942e4808c907df5b4e","size_bytes":162274,"source":{"filename":"corpus/racs_160/20250909__residents-experience-20250630__myagedcare.gov.au.pdf"}},{"kind":"doc_ingest","observed_at":"2025-09-08T00:00:00Z","provider_id":"racs_160","sha256":"28959ccf0b1c14457eb8c3fe3eb3f6a04194da2ad0955c20e7fa3d390c512b40","size_bytes":522595,"source":{"filename":"corpus/racs_160/20250909__audit-report-20150805__agedcarequality.gov.au.pdf"}},{"kind":"doc_ingest","observed_at":"2025-09-08T00:00:00Z","provider_id":"racs_160","sha256":"2fa9290ae34aac962cb281796dd4b3c0c56774a50a158a853618b2b4bb134063","size_bytes":513212,"source":{"filename":"corpus/racs_160/20250909__performance-report-20230611__agedcarequality.gov.au.pdf"}},{"kind":"doc_ingest","observed_at":"2025-09-08T00:00:00Z","provider_id":"racs_160","sha256":"52a2edbaacbe2cffcf68ff8bc91a2298940e5ccd55c1b6330253a65dcab20341","size_bytes":204588,"source":{"filename":"corpus/racs_160/20250909__audit-report-20090623__agedcarequality.gov.au.pdf"}},{"kind":"doc_ingest","observed_at":"2025-09-08T00:00:00Z","provider_id":"racs_160","sha256":"767f212cf0baf3a0ad5d79253bed25d7e155e885a9c1a741a8a9b1152e32a777","size_bytes":222161,"source":{"filename":"corpus/racs_160/20250909__audit-report-20180201__agedcarequality.gov.au.pdf"}},{"kind":"doc_ingest","observed_at":"2025-09-08T00:00:00Z","provider_id":"racs_160","sha256":"8bf8347671d761ab07b9021467933ba359b1899be608f12efe4461e97f37642b","size_bytes":121575,"source":{"filename":"corpus/racs_160/20250909__pricing-20250630__myagedcare.gov.au.pdf"}},{"kind":"doc_ingest","observed_at":"2025-09-08T00:00:00Z","provider_id":"racs_160","sha256":"b1279252c26199d99359a62e0c9ad43599e2d0a2c1cce5b24373e3f67cc39c0f","size_bytes":94652,"source":{"filename":"corpus/racs_160/20250909__audit-report-20120623__agedcarequality.gov.au.pdf"}},{"kind":"doc_ingest","observed_at":"2025-09-08T00:00:00Z","provider_id":"racs_160","sha256":"c369adaef66f22b08b31d64c91b139fc82bdbdaac20a4413a708dc52346dca5b","size_bytes":117117,"source":{"filename":"corpus/racs_160/20250909__compliance-20250630__myagedcare.gov.au.pdf"}},{"kind":"doc_ingest","observed_at":"2025-09-08T00:00:00Z","provider_id":"racs_160","sha256":"c7c45fdc5a309f83b65247fa0d206467af253eb6cdea41ec9a9d1f9dfae9c8f6","size_bytes":192369,"source":{"filename":"corpus/racs_160/20250909__staffing-20250630__myagedcare.gov.au.pdf"}},{"kind":"doc_ingest","observed_at":"2025-09-08T00:00:00Z","provider_id":"racs_160","sha256":"d1f15514e1825623838a03512118e886e67012e438e735d9b208b00c2b38da03","size_bytes":488482,"source":{"filename":"corpus/racs_160/20250909__audit-report-20190710__agedcarequality.gov.au.pdf"}},{"kind":"doc_ingest","observed_at":"2025-09-08T00:00:00Z","provider_id":"racs_160","sha256":"d7de2e804895c38b48d6ba3efc8588a56e672e7bde029f960a239c050e3fe58a","size_bytes":141838,"source":{"filename":"corpus/racs_160/20250909__overall-stars-20250630__myagedcare.gov.au.pdf"}},{"kind":"doc_ingest","observed_at":"2025-09-08T00:00:00Z","provider_id":"racs_160","sha256":"e3b0c44298fc1c149afbf4c8996fb92427ae41e4649b934ca495991b7852b855","size_bytes":0,"source":{"filename":"corpus/racs_160/.gitkeep"}},{"kind":"doc_ingest","observed_at":"2025-09-08T00:00:00Z","provider_id":"racs_160","sha256":"e80c2d414433b96881cb1746b3c1df1e0c0ce673529c6331b2b6f37a28a00fd1","size_bytes":172491,"source":{"filename":"corpus/racs_160/20250909__quality-20250630__myagedcare.gov.au.pdf"}},{"kind":"doc_ingest","observed_at":"2025-09-08T00:00:00Z","provider_id":"racs_160","sha256":"ef0304b4a07dcaf06ce3810596e01272f7d39e30d753c4406c0faea7b057ae02","size_bytes":128982,"source":{"filename":"corpus/racs_160/20250909__consumer-experience-20190523__agedcarequality.gov.au.pdf"}},{"kind":"doc_ingest","observed_at":"2025-09-08T00:00:00Z","provider_id":"racs_160","sha256":"ff8d07801349fed9de931d5a6c6fd377d3fe355f1dc48ec562ed0970519e132d","size_bytes":163719,"source":{"filename":"corpus/racs_160/20250909__finance-ops-20250630__myagedcare.gov.au.pdf"}}]},{"components":{"location":0.0,"needs":0.0,"price":0.5,"quality":1.0},"fit_score":0.45,"provider_id":"racs_1027","receipts":[]},{"components":{"location":0.0,"needs":0.0,"price":0.5,"quality":1.0},"fit_score":0.45,"provider_id":"racs_1067","receipts":[]},{"components":{"location":0.0,"needs":0.0,"price":0.5,"quality":1.0},"fit_score":0.45,"provider_id":"racs_109","receipts":[]},{"components":{"location":0.0,"needs":0.0,"price":0.5,"quality":1.0},"fit_score":0.45,"provider_id":"racs_13","receipts":[]}],"preset":"Balanced","query":{"budget_per_day":90.0,"needs":[],"postcode":"2000","radius_km":40.0}}